{
  "$schema": "https://json-schema.org/draft/2020-12/schema",
  "$id": "https://hushvoting.local/schemas/vulnerability-scan-normalized.schema.json",
  "title": "FEAT-134 Normalized Vulnerability Scan",
  "type": "object",
  "required": [
    "scanId",
    "scannerProvenance",
    "severityThresholds",
    "findings",
    "openCriticalHigh",
    "warnings",
    "acceptedExceptions",
    "freshness",
    "claimImpact"
  ],
  "properties": {
    "scanId": { "type": "string" },
    "scannerProvenance": { "type": "array" },
    "severityThresholds": { "type": "object" },
    "findings": { "type": "array" },
    "openCriticalHigh": { "type": "array" },
    "warnings": { "type": "array" },
    "acceptedExceptions": { "type": "array" },
    "freshness": { "type": "object" },
    "claimImpact": { "type": "object" }
  },
  "additionalProperties": true
}
