{
  "scanId": "SDS-VULN-HV-REL-BASELINE-2026-05",
  "scannerProvenance": [
    {
      "scannerId": "SCN-NPM-AUDIT-BASELINE",
      "toolName": "npm audit",
      "toolVersion": "baseline",
      "runAt": "2026-05-19T00:00:00Z",
      "inputRefs": [
        "hush-web-client/package-lock.json"
      ],
      "rawReportHash": "aaaaaaaaaaaaaaaaaaaaaaaaaaaaaaaaaaaaaaaaaaaaaaaaaaaaaaaaaaaaaaaa",
      "normalizerVersion": "feat134-normalizer-v1",
      "normalizedHash": "bbbbbbbbbbbbbbbbbbbbbbbbbbbbbbbbbbbbbbbbbbbbbbbbbbbbbbbbbbbbbbbb"
    }
  ],
  "severityThresholds": {
    "critical": "block",
    "high": "block",
    "medium": "warn_with_owner_and_due_date",
    "low": "record",
    "freshnessDays": 30
  },
  "findings": [
    {
      "findingId": "SDS-VULN-MEDIUM-BASELINE-001",
      "package": "example-transitive-dependency",
      "severity": "medium",
      "status": "open",
      "remediationOwner": "AboimPinto Consulting security maintainer",
      "dueDate": "2026-06-30",
      "detailsRedacted": true,
      "publicSafeSummary": "Medium dependency finding tracked with owner and due date."
    }
  ],
  "openCriticalHigh": [],
  "warnings": [
    "SDS-VULN-MEDIUM-BASELINE-001"
  ],
  "acceptedExceptions": [],
  "freshness": {
    "producedAt": "2026-05-19T00:00:00Z",
    "freshUntil": "2026-06-18T00:00:00Z",
    "maxAgeDays": 30
  },
  "claimImpact": {
    "internal_non_binding_rehearsal": "accepted_with_warnings",
    "friendly_organization_pilot": "requires_current_scan_at_pilot_time"
  }
}
